poeta,mes,año,categoria,llengua,texto,poetafullname
O,septiembre,2018,finalista,castellano,me ataba a la soga cada atardecer y la cortaba cada mañana así con el cansancio de la noche me obligaba a pasar el día que merecía porque ellos me hacía creerme hacer los efectos secundarios perduraban junto a la luz del sol en mis pulmones recitaba en la mitad de los versos tu mente exigía y aquí yacía  abocando gracias al precioso proyecto que recibió mi corazón a ese asqueroso golpe que me dijo pero no creáis que parecía triste mis 32 partituras seguían desfilando ante todas aquellas que sabrán mirarlas generando aquellos hoyuelos tan en nuestros capaces de engañar al mismísimo infierno y al mismísimo dios y es por eso que aunque a veces me vista con acciones vestidos que clavan la confianza del tiempo y me cante con zapatos verdes que anclan la esperanza suelo las roturas si no se curan siempre acaban superando entonces mis vestidos de paz se convierten en armaduras de guerra y se derroca en el clara esperanza de la cultura pero sigo sigo pintando de los labios rojo puta porque no soy como la vida pero aún así insidiosa y es por eso que hablo desde la libertad para acabar con esta muerte programada que la sociedad proclama la libertad del cerrado nos entre cinco paredes opacas ocupando nuestra vida entre cuatro funciones que sólo sirven para derrochar y ganar aumentando la osadía de un sistema inter capitalista que provoca la muerte espiritual a toda aquella que se encuentra sumergida de ella escribo para reivindicar estoy en contra las tres bases que nos marcan desde la inocencia de la infancia y perdónenme o hagan lo que les dé la jodida gana si me permito el lujo de vivir más allá de nacer parir y ya hacer muerto aunque también también lleno de rabia ante los dos padres que nos gobiernan y aseguran ser recuerdos que se llenan la boca de robos y engaños con el oculto invicto propósito de mantenerlos controlados y padres os juro capitalismo y el patriarcado que hará el acto intestinos o de pollas hasta provocar nuestro jodido paro cardiaco y consecuentemente nuestro jodido entierro y a ti como ayer te juro por tu memoria y la de todas aquellas que yacen enterradas por las que yates vivas y amordazadas que mi primera y única función es luchar la vida y su justicia estatal mundo que como gattaca tan adicto en el legado de sus folios aun siendo yo cuenta o no que mi muerte que tu muerte y misiles destino parezcan auténtica injusticia ,Olza
DO,septiembre,2018,ganador,castellano, párate madre desde en tu canto que un ran penumbra a la bondad del párate madre de ventana párate madre de té en la mano que mece la cuna' de mimbre cállate cállate madre de siria de sudan de yemen de afganistán cállate madre y de tentó una naked en la calle porque desde el ojo hambriento del huracán distante desde el centro del grito demente está viniendo monstruo gigante con manos gélidas está viniendo un monstruo demente con corazón de nunca está viviendo un monstruo terrible que aquí abra el sueño de dos niños y el nombre de ese monstruo es cara ya no te ataca taka taka taka y corta gargantas y aplasta todo pompas cuerpos guerra ciega de sangre avispero que es un bajo un bomba de gran guadaña de piel y hueso guerra garra en la tierra en cuerpos de ceniza en los que siembran la tumba tumba guerra que rompe a sacar nada de rencor te cagas gruesa y corazón de alambre tierra negrito interminable fuego que llegan ni un tierras a roca de sal estallido del cristal brutal que destruye todo cuanto tocan tocan tocan tocan tocan tocan tocan a último del viento un vídeo de lamentos detrás del cristal negro espíritu que audio  y desde arriba dios era inexorable altiva cruel y desde arriba dios todopoderoso y ciego que agarra cada uno de tus hijos y los pone de rodillas y con un gigante les dice tú  pero no yo eres madre no llores no llores madre de tantos y siempre de tantos no llores madre desidia de afganistán de yemen de sudán de sarajevo no llores madre porque donde se acaba la tormenta y no sopla el humo del disparo y no se siente el sinsentido de mente de los hombres donde se callan los gritos ahogados en lágrimas y descansan los cuerpos abogados en tenidas más allá de la tormenta donde termina el grito habrá un mar de bondad infinita que algún el sueño de tus niños perdidos habrá un mar de silencio infinito que con el sueño de tus niños perdidos braun mar de infinita bondad y el nombre de ese mar  a mí yo ya no digo nada ,dani orviz
AS ,Julio,2018,finalista,castellano,,Albert Svn
KV,Julio,2018,finalista,castellano,Dicen que el tiempo pone a cada uno en su lugar y una mierda el tiempo no cura ni soluciona nada y las manecillas del reloj no son las culpables de avanzar hacia callejones sin salidas y las horas escriben el guión y los minutos son esos humanos actores en este reparto de contradicciones donde pues ponemos el presente al flagelo del pasado el futuro del futuro ya ni hablamos que mañana temprano nos levantamos para que un dios nos tiente como vivir al cobijo de enfrentamiento escondido en representarlo pero claro entiendo que no hay mal funcionamiento no se pudran a quien queremos engañar para vetados en el destino en el signo y la providencia de poner nuestro culo al salvo que sin embargo no podamos en poner en pompa ante halagos y la que toneles emisoras de quién son los quieren como si claros queréis hablar de infamias del signo de nuestro destino queréis hablar del asesino y del carcelero de nuestra infancia de cada recuerdo que nos grita desde la re cuerda floja hablemos hablemos pues hablemos de cómo calcular el futuro pero latidos hablemos de cuántos relojes se han parado al incendiarse un corazón de cuántas veces hemos querido volver atrás en el miedo hablemos hablemos rasgando cada segundo hablemos colmando cada minuto mirémonos como eternos desconocidos olvidemos la relatividad de la piel desmemoria na miramos a las personas en momentos ya esos momentos en vellos de punta y verdades o dueños deseemos a destiempo amemos sin prisas ponemos despacio corramos sincronizadamente huyamos contrarreloj que esto esto no se trata de horarios ni calendarios más bien se trata de coger en la vida el bueno de construir castillos en el aire y fortalezas de arena de alinear el mundo comer los hilos y desnudar los la cámara porque si fuera cierto si fuera cierto eso que dice de que el tiempo pone a todo el mundo en su lugar joder entonces dime que conllevó aquí haciendo en el poeta en lugar de salir corriendo a tu lado ,Karlos Viadel
OS,Julio,2018,finalista,catalan,,Ona Salvat
DO,Julio,2018,ganador,castellano,,dani orviz
MA,junio,2018,finalista,castellano,al pie de un árbol triste para que arraigue su maldad un simulacro de muerte a la vida da vida a una futura muerte un manto encarnado encarna el aprendizaje del que quiere del sufrimiento a hacer su hemorragia de placer dos expresiones punzantes con una duda un tote y ver arrancadas se transforman en una farsa en manos sucias pesadísimo y embiste como la vida viste al que huérfano de ilusiones transita en un absurdo arrastrar de piedras pie el retazo rojo sangre reclama con arrojo cobarde su porción de desesperación y negada huida y el sucedáneo de vida echada responde cuál pésimo actor curtido en mil intentos de acariciar el pecho amputado de una musa el sucedáneo de vida estada pájaros solidarios con furioso enjambre de trinos aguijonean en agudas notas un mecanismo auditivo insensible al dolor ajeno incapaz de oír el grito en la mirada rumbro se disonante del que sufre para vuestro ojo sombras oscuras de cometa inverso a saeta en el rojo reclamo del vil engaño que marca el tránsito y la muerte capote de negra entraña susurra al oído ausente el absurdo nominal entregado por un virus humano y la maldad que rezuma de sus aciertos cráneos envenenan las raíces del triste árbol bajo el que representan un simulacro de muerte a la vida un simulacro de muerte a la vida que da vida a una futura muerte ,Manu Arpé
O,junio,2018,finalista,castellano,,Olza
OS,junio,2018,finalista,catalan,,Ona Salvat
AG,junio,2018,finalista,castellano, qué tendrá que ver el género con una botella de alcohol empecemos por la botella la botella sustantivo como un género femenino ella con capacidad para almacenar cualquier tipo de líquido o cualquier dato por íntimo que sea ella tan sentimental que cuando la vacían inclinada llorando está adjunta su destino ella con una forma sutil correcta precavida procura no salirse de los límites que la mesa le impone para no romperse porque ella es tan frágil y tan delicada ella aún de sus laterales vidriosos en torno a la cintura quebradiza de una abertura que conecta al exterior con el interior una abertura por la que penetra como una rosa de soja el vino verano y la sangre con sustantivo como un género masculino él huye de los compromisos tan pronto entra como sale de la botella el con capacidad física suficiente para hacer arder las gargantas el que nace de la uba violencia y tierna se convierte en química está así antich al mes y que llena el cuerpo de valor y las venas diamantes el es impetuoso nocturno este el color de la sangre el es importante el dar sentido a la botella porque sin él no hay pena en la que hojas se y así ante su entrada la discoteca en la quietud de la noche rota por un par de botes ebrios absorta en el pequeño tsunami acristalado que se produce cuando la botella choca contra el suelo tras cada trago indiferente ensimismada en medio del aire alcoholizado de un parque así aprendes algunos de los roles de género que hay escondidos en una botella de vino te frustras te desgarra se enfurece es porque estarás por harta y borracha de tanto estereotipo y entonces tienes lanzar la botella de vino contra todos los cuerpos y que los cristales empapados se claven en sus pupilas y lloren sangre de uva exprimida y se den cuenta de que no hay rol de género escrito en su saliva de que han sido atados influenciarse nacional embriagados alcoholizados por una botella de vino ,ainara garcia
ES,mayo,2018,finalista,catalan,,Eli Sanz
CS,mayo,2018,finalista,castellano,rueda redonda la vida y el tiempo que abraza y separa me hace volver otra vez a lo que creía mañana fósiles milenarios ahora petróleo reciclados como plástico del futuro pero quien reciclar a la memoria del tiempo y la tierra y sus rocas dejar en herencia una bolsa de 500 años de vida recordando mis hijos que soy igual que ayer ciega torpe aunque sí y aunque todos que un humana la pereza este dejarnos arrastrar por la rueda qué fácil es rodar alrededor de un ombligo minúsculo que sólo entiende de bordes y ahora de prisa sino horas de todo para desde ayer vamos directo al pasado camino al futuro rodan que es un verbo bello de viena energía huella y camino plaguicidas por encima de los niveles permitidos en el agua del río que riega mis plantas nitrógeno y óxidos rascando mi piel limando pulmones quemando los ojos de todas me miro al espejo y el hámster que veo se echa a correr y giro más rápido y más yo giro corriendo hacia ningún lugar rodando pendiente abajo hacia quién sabe dónde como si me persiguieron a nada y tuviera que demostrar cuando ha conseguido cuánto acumulado a costa de acabar con todo el hámster que soy mejillas repletas pero a un plátano cortado a rodajas servido en bandeja de plástico latir a un lado sin dejar de correr y más tarde un cadáver envuelto me espera comer y arrancó la vida sin darle las gracias no queda tiempo y sigo y voy a beber y veo en botella de plástico y en este momento de verdades plásticas e ignorancia absoluta de padre y conté la pendiente que me devoró en mi caída hacia él no pienso pero existe un clavo se clava en la y rompe destino a veces en forma de alergia alergia un químico que no sabía había en el pan que vivía en mi pulmón o en el estómago de un pez que es ahora mi pecho a veces en forma de un tumor maligno que como iba a saber yo si nadie me había dicho con lo poco acostumbrada que estoy a escuchar palabras que no sean ombligo rodar más rápido las ruedas se para y qué vértigo y entonces que calma mi ombligo se abre sus bordes se ensanchan y escupo las prisas que llenaban mis ojos y hacían de mis armas una mano de destrucción masiva escucho que las rocas me hablan se pone a llover y parece que algo cb me alejo del centro y de su gorrito gris que oculta la ciudad yo también soy eso esto es ya mi historia miro mi rueda ya rota y descubro que un paro pequeño un pequeño palo es suficiente para detener un mundo entero y divulgar en el futuro en que elijo convertirme ,crisal rodriguez
AG,mayo,2018,finalista,castellano, café grano molido que se tuesta en tus labios pardos para estimular cada célula somnolienta de tus desayunos más cargados café semilla ocre con la que os drogas matinal mente café bebida cuya amargura es atenuada por la glucosa del azúcar café bebida muy amargo le silenciada por el modelo neocolonial que succiona cada céntimo de la pobreza extrema café empresario de multinacional con grandes beneficios de un espresso doble en vacaciones café agricultor con un par de monedas en el bolsillo y un cortado sin leche en vacaciones café vida para un estudiante desarrollado en periodo de exámenes café muerte para la infancia de un niño subdesarrollados sin educación café persona dependiente de este cultivo para poder vivir todos los días café persona dependiente de este cultivo para no dormirse todos los días también explotaciones de cafeína en los campos de tío que es de mi lengua papilas gustativas que abrazan con setas de esclavitud café pesticidas que borbotean en mi garganta y la tierra llorar café deforestación de hectáreas esquiladas y la corteza llorar café ecosistema desnutrido polvo no cultivo intensivo el pájaro no vuela en el calor de una taza y cultivos de sudor estire largas horas de trabajo físico extenuadas bajo el sol en el calor de una taza de recursos naturales abrazados por el capital no solo estoy hablando de café en el calor de una tarta y familias enteras crepitando en las cenizas de occidente en el calor de una taza y países maltratados por la ley del más fuerte en el calor de una taza hay una hipotermia en busca de otro trabajo en el calor de una taza y trabajos de poesía y tragos de agua y en cada sorbo en cada punto sordo hay un niño ahogado y pupitres vacíos pero nosotros que nacimos metrópoli y ahora somos privilegio olvidaremos porque la vida sirve porque nos sufrimos porque necesitamos olvidar que hay una culpa del azar carcomiendo nuestra espalda y escrito este café con una este poema con un café 30-0 a los gritos de poema con una tarde entre verso y verso isr ide empapan números de dos y lavando las manos olvidaremos y seguiremos olvidando y seguiremos bebiendo café y seguiremos trabajando poesía ,ainara garcia
MB,mayo,2018,ganador,castellano, petrificada estática paralizada en el punto muerto casi exacto noto dura ti bari en mí con este compás de 4x4 soy métrica del romance actitud de magnate y un corte de mangas bien grande dedicado al capullo baboso que se cree interesante  quiero dejar de fumar pero sigo petrificada estática paralizada en el punto de fuga de este había 4 que bifurca tus curvas y las fuero el laberinto recorrido por trastos cubiertos de máscaras que con las copias del dios demiurgo creen saber las verdades más exactas venganza para sapo kriptonita para el superhombre que no ve más allá del bien y el mal quiero críticas destructivas como las de un gran a kan cerrar la puerta y sobrevivir en mi propio infierno como sartre aprender sabiendo que soy una maestra ignorante que aplican sus alumnos del sapere aude que prefiero en cultos abiertos de mente antes que intelectuales que seguro que saben mucho de nada y que por esto culpan de los problemas a los inmigrantes el debate se aleje de la lógica y configuremos con las palabras un baile que viva el vírico volvamos a babilonia y dejemos que los astros se jueguen a los dados nuestro destino que el que quiere ausente como en el 1 y yo que no haces 3 nunca siempre fuimos más de miguel' es el rayo que alumbre al españolito que viene a españa que quiere vivir ya vivir en pieza pero en un país de manchados que se niegan a perder una pieza de su condado condenado a golpe de estrado que tira las obras del pueblo y se traga la clave del candado la ciencia se atasca la tecnología prospera ahora un váter se desinfecta solo como el enfermo en la sala de espera químicos barbitúricos en general sustancias que permitimos que se mantengan al margen de laboral dame un ibuprofeno me la pela que vaya a proporcionar a los nazis tu dinero que sabré yo si soy una cara bonita y no me queda más remedio que serlo fíjate de la gente que lleva a los posibles fundidos de esos que se arrancan la piel con sarna sido frenéticos pensando que están repletos de picadas de mosquitos autodestrucción permitida más allá del cuerpo venero exijo veneno soy joven pero ya veo como funciona el mundo y no me gustan un pelo y por eso en el cambio insisto nos queda tiempo al arte siempre lo tuvimos y ahora está bordería repelente de la nueva generación de mujeres que no tienen miedo a enseñar los dientes así que sonríe pero ante la sociedad muere ,marta b
PT,abril,2018,finalista,castellano, mediterránea que playas más bonita y despegan con esas aguas templadas con esas aguas serenas otra grada tranquila azul como el cielo mío como un potro galopando el río ebro llega a ti si tú no estás entrando tranquila como si fuera acabando que se va enredando contigo cuando queda al final beso queda en tus brazos el abismo de internet que tienes por dentro yo siento curiosidad porque se llaman el mar y llamar al mismo tiempo y agregar la primavera aunque tú no tienes flores llegar aquí la mujer es lo mismo que las abejas que van buscando sus pieles y se quitan toda ropa para mostrarte eso en tanto por título acuerdo con sensor contigo pero llega aire pero que calles y levantan la amarilla siempre está en movimiento por duermes por la noche y tampoco te echa la siesta la dirección el miedo siempre tienes puertas abiertas y dejan que tiene que detallar si eres embargo te quiero si en el caballo te adoro si eres la mal porque muere una mañana destino que me encontraba en la playa entre la sierra y la mar y como las barreras dándose abrazos y besos locas locas de amor se encontraban yo quería estar con las dos por su orilla paseaba aún plantaba con la arena del otro dentro de la mirada bravo que veía al otro pago de cuotas sin interés me tropecé con vitola para una niña que jugando saltando dentro del agua entre un vaivén de columpio de las hojas creó para ir arriba acariciando con sus manitas de plata el aire se quedó quieto el sol y que la miraba y consultar bailar la niña se ha pronunciado la madre sigue invitando con su agua limpia fraga atún parece que el cielo se ha caído esta mañana y la tierra esta dura es mucho cómo me llama vez es alabar me dice que se entregará mañana yo la miro tan intensa tan ser quinta tarde jaja tarde están señora tan bella vista tan guapa porque eres dentro de esos ceros que no me deja mirarlas y yo las quiero a las dos y las quiero como hermanas el regado medio-bajo se ha recordado allá me levanté despacito poniéndome las sandalias porque la avena parece que el sábado 5 sus grasas y la banderita verde me dice ves no te vayas que entra no le tengan miedo cuando van está en calma ,Pedro Toledano
YB,abril,2018,finalista,castellano, señor profesor quienes soy yo llegó mi pregunta escondida de mochila cargada de conceptos logaritmos trigonometría física química las cintas más nominales síntomas verbales artículos metáforas lecturas obligatorias notas apuntes y exámenes pero desencuentro modelos a seguir quienes soy yo la respuesta no llega no me visita me gusta acudir a un centro día tras día que tendría que ayudarme a indagar a encontrarme para poder ofrecer mi valor mi poder y talante pero no lo hacen señor profesor quiere soy yo mejor quién es usted se atreve a descubrirme a quien escudo usted detrás de un cargo que le da licencia anularme quién es usted porque me castiga cuando lo cumplo una norma o como cuando estoy para cuestionar de un comentario suyo que fue escrito descrito antes de que yo naciera y que en estos momentos no mueve ni la más mínima de mis pestañas señor profesor de qué está hecho usted muéstrenme la verdad de lo que lo trae aquí cada día muéstrenme que le importa lo que suceda en mi vida dígame en qué hay una salida me les interesa' apis ganas de salir corriendo de aquí a que la respuesta nuestra en la obligación sino en el placer el placer que descubre que hay algo más algo más más allá del saber señor profesor dígame quién es usted solo así saldrá de mi boca aún carente de respuestas un signo amable de aversión a lo que usted persigue que espero que sea ayudarme a crecer y a proveer al mundo de un sentido que ha perdido o ha dejado olvidado en algún lugar equivocado porque este es mi destino señor profesor le pido que no deje que la rabia por no obtener la atención que esperaba le haga sacar el látigo del castigo y genere este un diálogo conmigo no me dé por vencido ayúdeme a adorarle a que se convierta a usted en uno de mis anclajes en un recuerdo que da fuerza cuando el aire azota tormenta y la vida se pone fea señor profesor del ejército y aún confío que no va a desestimar me muchas ,Yolanda Barneda
AG,abril,2018,finalista,castellano, dime tú que has visto los cielos enredados de nivermes los ríos raudos de mi cuerpo el azul regio de mi vida las ramas conductoras pero mi savia el vaso lleno tengo un rubí vendido la razón de mi latido dime tú seas visto cristales rotos en mis pómulos cráteres aciagos de mi luna círculos deformes derramados transparencias de una llaga con pretexto reflejos invitados de un viento que da de cara goteras de dos espejos abandonamos bien tú has visto llorar dime tú si has visto el pincel pintado de un atardecer los poros supurando de una piedra la unión del néctar con la lengua de una abeja el agua los cantos de una carta los bailes que se ondula en una llama el cuerpo satisfecho dime tú si no has visto amar y si tu respuesta es sí quizás algún día llega este dardo certero de un diario con un punto final en el principio en vez de perderme en la fe de una creencia y de clavarme silencios mal creados en las vísceras quizás algún día deje de hacer abstractos los pigmentos de los manos a punto de tocarse quizás encuentre la verdad en las alas de un ángel a pero sí me has visto sangrar me has visto llorar y me he visto amar,ainara garcia
MB,abril,2018,ganador,castellano, primero debo tocar las aristas de mi mundo para saber cuánto puedo soportarte primero aprendí en una tarima que el silencio cuando lo escuchas deja de ser mudo pero si callo estallo y me hallo cubierta de astillas cuyos pedazos de perdí la forma en tus tran risa en el muro primero cortó el dedo del veterano que me señala para pisar el piso que tapa con su ego primero como las migas y me guardo la mayor parte de mi bocadillo porque no me fío del mañana primero inyectaré  líquido falso en tu ventrículo derecho si mi culo fue el único motivo que tuviste para dormir bajo mi techo jodida ventrílocua que ha pintado la india en su muñeco y aunque sea mentira se la vez tan bonita cuando finge un yo también te quiero y recreo el parpadeo que generaste diciendo lucha en su guerra es peor la de vista adentro y primero siento la gracia bailando elegir si siento no de burla mirando como ronco me sin acción acoger tu brazo para caer en el ojo del campo gravitatorio que se tragaría el ejército de carlomagno con solo rozar un tercio de tus manos primero y otros dos pupilas dilatadas en la parte inferior del espejo de la entrada aunque vayas en la casa el único objeto manchado por mi vomito poético son tus bragas querías un retrato así que puse mis dedos en acuarela y mientras te follava en el abismo del 8 de nuestras piernas redacte una novela de tapa dura y páginas negras y ya se que el sexto es el mástil de la barca y que por esto nuestro viaje todavía no se acaba algún día encontraré a alguien que ama de verdad seguramente no sea la primera mujer que me quiso no supe decirle mama qué te pasa te noto ausente porque no mira hasta la cara que salió de tu vientre ,marta b
G,Marzo,2018,finalista,castellano, columnas de papel envejecen tus retiros que en la pgje la mitad eros el viviendo en tus entrañas querría cohabitar contigo como sísifo en tus palabras a sus quehaceres ya no son castigos porque tú lo rescatase de su pena al versar su condena sin prisa a un preso seré tu calma tu regreso y te quieres sentidoeros vivo en este suelo de madera cerca de mi oído sin ser embustera recito que no te olvido ni a ti ni a tu hoguera aunque estés perdida trago mis dedos en el pincel tu arranca hojas de diarios me vivo acérrima a lograr tu desnivel pero tu cavalga en tus delirios que yo me ocupo yo angel de tu pelo,Ginebra
